utterance_id	speaker_id	target_id	reply_to_id	utterance
74	P00263	P00264	72	Sr.ª Presidente, Sr. Deputado Luís Fazenda, na sua intervenção colocou alguns temas de relevantíssima importância, começando, desde logo, pelo tema do acréscimo do risco de pobreza, talvez o mais importante, porque é aquele que nos convoca com maior insistência à nossa responsabilidade. Esse tema será, aliás, aqui tratado mais tarde pelo Partido Socialista. Colocou também questões relacionadas com o Serviço Nacional de Saúde. Existe um padrão de comportamento deste Governo desde há muito tempo que não começou pelo CITIUS, que não começou com a colocação dos professores — que já tinha começado antes — , mas que se mantém, que é o padrão de comportamento da negligência dos cortes cegos que depois têm estas consequências. Portanto, Sr. Deputado, fez bem em referir também esses temas. Quanto à questão da política europeia e das evoluções que estão a ocorrer ao nível da Europa, o Sr. Deputado referiu as iniciativas do Governo grego. Devo dizer, Sr. Deputado, que estamos a ficar na altura em que, sem as euforias da semana passada, podemos debater com alguma seriedade e alguma contenção estas questões. Porém, fiquei surpreendido pelo facto de não ter comentado alguma evolução que o Governo grego tem vindo a fazer no que diz respeito à reestruturação da dívida, que nos parece uma evolução sensata, designadamente respeitante às questões relacionadas com a desnecessidade de impor um haircut ou com o compromisso, mais uma vez, assumido pelo Primeiro-Ministro grego de que iriam pagar a integralidade da dívida. Parece-me importante notar esta evolução. Importante, sobretudo, não para salientar qualquer tipo de recuo ou qualquer tipo de evolução, mas para registar que o Governo grego está a ter um contributo que me parece útil ao nível da discussão destes temas da Europa. Devemos registar aqui esse contributo e devemos, aliás, aproveitá-lo. Queria aqui dizer que me parece de todo desajustada a posição do Governo português de não estar a acompanhar com atenção e com o devido interesse este debate que está a acontecer na Europa.
75	P00001	P00263	74	Queira concluir, Sr. Deputado.
76	P00263	P00264	72	É inegável que a Europa não mudou, mas é também inegável que o Governo grego está a introduzir na Europa fatores de discussão que são importantes. Queria aqui registar este facto, mas gostava de ouvir um comentário por parte do Sr. Deputado em relação à evolução verificada ao nível do Governo grego.
77	P00001	P00264	72	Para responder, tem a palavra o Sr. Deputado Luís Fazenda.
78	P00264	P00263	76	Sr.ª Presidente, Sr. Deputado Vitalino Canas, agradeço as suas observações. Neste momento, quer do ponto de vista europeu e dos responsáveis gregos, quer do ponto de vista de outros responsáveis do Eurogrupo e dos vários Governos dos Estados-membros, as notícia que temos, pela imprensa internacional e por uma ou outra declaração que tem vindo a ser mais comentada, é de que há negociações bilaterais e há um processo que está em curso. Nós não vamos comentar um processo que está em curso.
79	P00330	P00264	78	Exatamente!
80	P00264	P00263	76	» e, portanto, quer enfrentar o debate e o problema da Grçcia. São declarações de hoje da Sr.ª Merkel dizendo que não haverá nenhuma crise extraordinária para a consolidação de finanças públicas. Não sei exatamente o que isso quer dizer, é o problema de se fazerem prognósticos antes do fim do jogo, como diria o outro, mas aqui há alguma necessidade de atualizar aquilo com o qual concordo com o que o Sr. Deputado disse: é que a atitude que o Governo português tomou continua a tomar como é subserviente — aliás, subserviente é dizer pouco — em relação àquilo que tem sido o troiquismo dominante.
81	P00327	P00264	80	Já não temos troica!
82	P00264	P00263	76	Portanto, capitulou completamente. E se é importante para Portugal saber como é que se lida com as dívidas soberanas e com o conjunto das dívidas externas, Portugal está ausente, Portugal está a fazer o lugar do morto.
83	P00001	P00264	82	Queira concluir, Sr. Deputado.
84	P00264	P00263	76	Portanto, esse papel é o de escudo humano em relação à política da Sr.ª Merkel. Era tudo isso que nós não pretenderíamos em Portugal, atualmente; pretenderíamos uma atitude ativa da parte do nosso Governo. Esperemos que ainda tenhamos aqui, na Assembleia da República, o debate sobre a próxima cimeira europeia.
85	P00001	P00002		Concluída a declaração política do Bloco de Esquerda, informo que a próxima declaração política é do PSD. Tem a palavra o Sr. Deputado Luís Vales.
86	P00581	P00002		Sr.a Presidente, Sr.as e Srs. Deputados: Se há setor que tem contribuído fortemente para a recuperação económica do País, esse setor é o do turismo. Esse feito deve-se ao trabalho extraordinário dos portugueses, em especial dos empresários e agentes envolvidos na sua ação e dinamização. A estratégia do Governo é clara: fazer mais com menos!
87	P00218	P00581	86	Como é que se faz para visitar esse País?!
88	P00001	P00002		Srs. Deputados, a Mesa regista a inscrição dos Srs. Deputados Acácio Pinto, do PS, João Ramos, do PCP, e Hélder Amaral, do CDS-PP, para fazer perguntas e está informada que o Sr. Deputado Luís Vales responderá conjuntamente. Assim, tem a palavra, em primeiro lugar, o Sr. Deputado Acácio Pinto.
89	P00290	P00581	86	Sr.ª Presidente, Sr. Deputado Luís Vales, saúdo-o pelo tema que aqui trouxe hoje, mas quero dizer-lhe que poderia ter começado a sua intervenção com a expressão «Apesar do Governo»». Apesar do Governo, nós também registamos os resultados positivos do turismo. E digo «apesar do Governo», porque o Governo tem sido, nesta matéria, uma inexistência. Pelo menos, podemos dizer que não atrapalhou as empresas, não atrapalhou as regiões e, Sr. Deputado, não atrapalhou as autarquias de desenvolverem um excelente trabalho nesta matéria.
90	P00327	P00290	89	Que era o que os senhores faziam no passado!
91	P00290	P00581	86	Mas, Sr. Deputado, há questões com que quero confrontá-lo, as quais têm a ver com o turismo interno, que o Sr. Deputado escamoteou. No turismo interno, Sr. Deputado, como sabe, se tem acompanhado esta área, não há nenhuma estratégia do Governo, não há qualquer estratégia para promover o turismo interno — aliás, a única estratégia que o Governo tem seguido é a do empobrecimento dos portugueses. E a este propósito, coloco-lhe, desde já, uma questão: qual é a palavra que o Sr. Deputado tem a dizer sobre os últimos dados do INE, segundo os quais há 5,7% de diminuição nas viagens internas? Diga-nos algo sobre este valor do INE de 2014. Já agora, quero também saber o que tem para nos dizer sobre a distribuição territorial dos impactos do turismo no nosso País. É que, efetivamente, Sr. Deputado, há regiões do nosso País onde o turismo atravessa grandes dificuldades. Ainda hoje, o presidente da entidade do Centro diz que, na região Centro, há empresas em dificuldades e há mesmo alguns hotéis a fechar. Diga-nos também uma palavra sobre isto. Finalmente, Sr. Deputado, uma palavra sobre a ENATUR (Empresa Nacional de Turismo). O Sr. Deputado pode explicar-nos o que se passou para o recuo do Governo na privatização de 51% da ENATUR? O que é que se passou em relação a isso? Explique-nos, porque, efetivamente, o PS fez uma pergunta sobre esta matéria ao Ministro da Economia e, até hoje, não se dignou responder ao Partido Socialista. Não sabemos se foi pela pergunta que recuaram, mas, de qualquer modo, gostaria de saber porquê. Mesmo para terminar, o que é que o Sr. Deputado tem a dizer sobre o facto de este Governo, desde 2011, não ter apresentado aos portugueses a Conta Satélite do Turismo, que é uma conta exigida, deixe-me dizerlhe assim»
92	P00001	P00290	91	Queira concluir, Sr. Deputado.
93	P00290	P00581	86	Estou a terminar, Sr.ª Presidente. Como estava a referir, o que é que o Sr. Deputado tem a dizer sobre o facto de este Governo, desde 2011, não ter apresentado aos portugueses a Conta Satélite do Turismo, que é uma conta exigida pela Organização Mundial de Turismo? Trata-se de uma conta importantíssima para que os empresários e os portugueses possam fazer opções concretas na área do turismo. Deixe-nos uma palavra sobre a Conta Satélite do Turismo.
94	P00001	P00002		A próxima pergunta é do PCP. Tem a palavra o Sr. Deputado João Ramos.
95	P00582	P00581	86	Sr.ª Presidente, Sr. Deputado Luís Vales, o Sr. Deputado traz-nos aqui uma espécie de novidade, ao ocupar o espaço do CDS nas questões sobre turismo. Habitualmente, no debate parlamentar, é o CDS que puxa pelo seu Ministro e pelo seu Secretário de Estado, agora, temos o PSD a entrar também nesta matéria.
96	P00581	P00582	95	O Governo é só um!
97	P00582	P00581	96	Mas isso é irrelevante. O que gostava de lhe dizer é que o Sr. Deputado fala no sucesso do turismo, e o CDS também fala nesse sucesso, baseado nos dados do INE. E a estatística do turismo para 2013 fala num aumento das receitas, num aumento das dormidas, num aumento dos proveitos. Os proveitos no setor do turismo aumentaram, em 2013, 1900 milhões de euros, ou seja, 7,7%. Mas as estatísticas também dizem outras coisas, que, normalmente, os senhores não referem, como, por exemplo, a de que o número de establishments, em 2013, diminuiu e o número de camas teve um ligeiro aumento, ou seja, há um processo de concentração no setor. E também nos dizem que o número de dormidas de não residentes aumentou, mas o número de dormidas de residentes teve um decréscimo, pelo que os portugueses estão a fazer menos turismo em Portugal. Portanto, há aqui outros dados de que os senhores não falam. Por outro lado, falam no sucesso, como se fosse um sucesso para todos, esquecendo, por exemplo, um setor importante, que é o setor da restauração, e o IVA da restauração, que não é, de modo nenhum, encaixado neste sucesso. Aliás, o Governo continua sem publicar as estatísticas do IVA para poder demonstrar aquilo que diz, ou seja, que o aumento do IVA no setor da restauração contribuiu efetivamente para um aumento da receita de IVA. O Governo diz, mas não consegue demonstrar, porque não publica as estatísticas do IVA. Mas, depois, há outra forma de analisar os números e não precisamos de ir buscar as estatísticas. Também podemos ir aos números e às estatísticas do Ministério da Economia e do Governo. Dou-lhe o exemplo do Gabinete de Estratégia e Estudos do Ministério da Economia, neste setor que os senhores dizem ser um sucesso, que é o melhor setor exportador. Efetivamente, as estatísticas dizem que é o maior setor exportador, mas, por exemplo, o ganho médio mensal dos trabalhadores no setor do alojamento, restauração e similares caiu, nos últimos três anos, 7,5%. O ganho médio dos trabalhadores deste setor caiu 7,5% nos últimos três anos. Por exemplo, o setor do turismo é o que pratica os salários mais baixos de toda a economia portuguesa, à exceção dos setores dos têxteis e do vestuário. Isto também é dito pelo Ministério da Economia.
98	P00580	P00582	97	Bem lembrado!
99	P00322	P00582	97	Veja lá o sucesso!»
100	P00582	P00581	96	Ou, por exemplo, que, no setor do turismo, 21% dos trabalhadores recebem o salário mínimo nacional, enquanto a média nacional é de apenas 2%. Isto também é dito pelo Ministério da Economia. É fácil perceber que uma parte deste sucesso de que os senhores falam é à custa da sobreexploração dos trabalhadores.
101	P00322	P00582	100	Exatamente!
102	P00582	P00581	96	Por isso, Sr. Deputado, era importante que nos dissesse, e daí que lhe pergunte, o que é que o PSD acha, por exemplo, dos estágios curriculares no turismo, que estão a substituir postos de trabalho, ou o que é que o PSD acha sobre os problemas que os trabalhadores têm, e que o Ministério da Economia reconhece, num setor que teve 1900 milhões de euros de proveitos, o maior setor exportador. Por que é que este sucesso não tem reflexos no salário e na qualidade dos postos de trabalho destes trabalhadores?! Entretanto, assumiu a presidência a Vice-Presidente Teresa Caeiro.
103	P00001	P00002		Ainda para pedir esclarecimentos, tem a palavra o Sr. Deputado Hélder Amaral.
104	P00302	P00581	96	Sr.ª Presidente, Sr. Deputado Luís Vales, queria felicitá-lo pela iniciativa da sua declaração política. Não sei se percebi bem, mas fiquei com a expectativa de que algo de novo, nunca visto, vai acontecer: o Partido Comunista Português prepara-se para, mais dia, menos dia, fazer uma declaração política sobre turismo, não querendo que essa matéria seja só discutida pelos partidos da maioria. É bem-vindo, Sr. Deputado João Ramos, quando quiser. Poderemos até dar uma ajuda, porque ainda há alguns dados estatísticos. Ficava-lhe bem, porque retirava a ideia, que parece ser uma certeza, de que a oposição, qualquer que seja o resultado positivo, em qualquer setor da economia ou da vida portuguesa, foge dele como o diabo da cruz,»
105	P00582	P00302	104	Salários!
106	P00302	P00581	96	» parecendo que só quer olhar para o lado negro da História.
107	P00262	P00302	106	É verdade!
108	P00302	P00581	96	Se há setor em que, de facto, se devem dar os parabéns aos empresários e aos trabalhadores, aos portugueses que nele trabalham, é o do turismo. Mas também quero referir — e vou fazê-lo com todo o cuidado pela amizade que me une quer ao anterior Secretário de Estado, quer ao atual — que se há matéria em que podíamos fazer um exercício de «descubra as diferenças» entre a governação da maioria e a do Partido Socialista, é exatamente a do turismo. É que, enquanto o Governo, fazendo pouco, na opinião do Sr. Deputado Acácio Pinto, reviu a lei das agências de viagens, simplificando e retirando burocracia, reviu a lei das entidades regionais de turismo, simplificando, dando autonomia e mais poderes, e eliminou um conjunto de licenciamentos, o que é que fez o
109	P00262	P00302	108	Ora!
110	P00302	P00581	96	Entre um Estado que absorve todo o esforço dos portugueses e um Governo que quer simplificar a vida dos empresários e dos trabalhadores, aqui está a diferença que nos separa. O Partido Socialista está igual a si próprio: mal descobre um setor a crescer, um setor a ter resultados, o que é que faz? Apropria-se desses resultados e procura ir aí buscar rendimento para a sua política.
111	P00262	P00302	110	É verdade!
112	P00351	P00302	110	Foi por isso que, no Amadeus, o elegeram «Gestor Põblico do Ano»!»
113	P00302	P00581	96	O que é que faz a maioria? Protege esses resultados, simplifica, retira obstáculos e é um parceiro fiável do setor. É por isso que acho que tem alguma razão quando diz que nada está feito, mas temos estes dados: 14% do PIB; Portugal está no top 3 dos países onde o turismo mais cresce; em novembro de 2014, tivemos 2,4 milhões de turistas, batemos records. Diria que os problemas que o Deputado do Partido Comunista Português aqui trouxe, com alguma razão, e que V. Ex.ª também aqui trouxe, resolvem-se com três coisas: mais turistas, mais turistas, mais turistas. E é isso que está a acontecer: estamos a ter mais turistas, mais turistas, mais turistas.
114	P00001	P00302	113	Sr. Deputado, queira concluir, por favor.
115	P00302	P00581	96	Vou terminar, Sr.ª Presidente. Têm alguma razão quando dizem que temos de olhar para o turismo interno. É um facto! Estes dados devem ser uma boa base de partida. Agora, temos de olhar para o território, temos de olhar para a criação de produtos, temos de consolidar destinos, temos de requalificar a oferta. Este é um passo que devemos dar, mas até nesta matéria — e sei que o Sr. Deputado Luís Vales me vai responder — estamos a fazer muita coisa, coisa que nunca foi feita. Isto para além do reforço do financiamento das entidades e das agências regionais de turismo, que representa um record em relação aos Governos do Partido Socialista, que cortaram verbas e retiraram autonomias ao território, às autarquias e às entidades regionais de turismo. Até nesta matéria, Sr. Deputado Luís Vales, diga se é ou não verdade que fizemos muito mais do que foi feito por algum Governo do Partido Socialista.
116	P00001	P00002		Para responder, tem a palavra o Sr. Deputado Luís Vales.
117	P00581	P00290	93	Sr.ª Presidente, Srs. Deputados, antes de mais, agradeço as perguntas dos Srs. Deputados Acácio Pinto, João Ramos e Hélder Amaral. Fico preocupado com algumas das questões que me foram colocadas, nomeadamente da parte das bancadas do PS e do PCP. É que, mais uma vez, Srs. Deputados, até neste setor, que, enfim — acho que disse tudo na tribuna — , significou 14% do PIB, teve números extraordinários, e não foi à custa dos partidos políticos,» » mas dos portugueses, dos operadores, dos municípios, das entidades regionais»
118	P00322	P00581	117	Dos salários dos trabalhadores!
119	P00581	P00290	93	» e tambçm do Governo e do Turismo de Portugal.
120	P00327	P00581	119	É verdade!
121	P00581	P00290	93	Apesar de tudo isto, e com este sucesso, continuam zangados, incomodados com os números positivos, até nesta área do turismo! Srs. Deputados, penso que essa matéria não colhe do ponto de vista eleitoral, porque os portugueses também gostam de ter um sorriso na cara de vez em quando. E o turismo é um motivo para sorrir neste País. Relativamente à questão do IVA da restauração e das suas dificuldades, de que falámos, respondo-lhe que houve, naturalmente, e há, empresas em dificuldades, mas quero aqui relembrar a recente diminuição do IRC e as alterações feitas ao IRS. Por conseguinte, a seu tempo, depois da bancarrota a que nos trouxe o Partido Socialista, é natural que haja aqui um período de ajustamento. Tenho esperança que o IVA da restauração veja a sua carga diminuída, quando assim for possível. Srs. Deputados, também fiquei um pouco estupefacto com algumas declarações que foram feitas relativas ao turismo interno. Gostava de dizer o seguinte: em 2014, todas as regiões do País viram o seu turismo aumentar exponencialmente. Ninguém diz que não existem dificuldades no setor, claro que sim, em todos os setores há dificuldades; há empresas que singram e outras que se dão menos bem, dependendo, naturalmente, do seu plano de negócios. Mas há uma coisa que é inequívoca, Srs. Deputados: o turismo subiu em todas as regiões do País. A este propósito, quero responder ao Sr. Deputado Hélder Amaral, que referiu as entidades regionais de turismo, dizendo-lhe que creio ser também isto que nos distingue. Antigamente, nos governos socialistas, fazia-se tudo a partir de Lisboa — de Lisboa para o Porto, de Lisboa para o Alentejo, de Lisboa para o Algarve — , hoje, faz-se diferente; hoje, as entidades regionais de turismo têm a sua importância e, de uma forma cooperativa e até mais inteligente, elas sabem o que a região pode oferecer enquanto destino turístico. Por isso, queria aqui também deixar um bem-haja às entidades regionais de turismo e a essa forma que mudou, de facto, a maneira de fazer política no turismo, em Portugal.
122	P00001	P00002		Para proferir uma declaração política, tem a palavra a Sr.a Deputada Sónia Fertuzinhos.
123	P00329	P00002		Sr.ª Presidente, Sr.as e Srs. Deputados: «Só vamos sair desta situação, empobrecendo em termos relativos e em termos absolutos» — disse o Primeiro-Ministro Pedro Passos Coelho no dia 25 de outubro de 2011. Na altura, não se percebeu se esta declaração do Primeiro-Ministro era uma promessa ou uma ameaça. Seja como for, por uma vez o Primeiro-Ministro cumpriu o que prometeu! Portugal está mais pobre. As pessoas e as famílias, em geral, estão mais pobres e os que já eram pobres estão, hoje, ainda mais pobres. Traduzindo os números da pobreza em portuguesas e portugueses: entre 2012 e 2013, em apenas um ano, mais 110 000 portugueses e portuguesas caíram no risco da pobreza; entre 2011 e 2013, em apenas dois anos, mais 450 000 pessoas caíram na situation de pobreza. Para percebermos melhor a realidade dramática destes números e da vida destas pessoas, temos de lembrar que estes portugueses e estas portuguesas caíram no risco de pobreza por viverem com menos de 433 € por mês, 12 meses num ano, o valor que, em 2009, definia o limiar da pobreza. Sr.ª Presidente, Sr.as e Srs. Deputados: Estes números, que traduzem a vida, o dia a dia de 2,7 milhões de portugueses e portuguesas — repito, Sr.as e Srs. Deputados, 2,7 milhões de portugueses e portuguesas — , não são fruto do acaso nem o efeito inesperado de uma qualquer política que correu menos bem. Não, Sr.as e
124	P00006	P00329	123	Muito bem!
125	P00329	P00002		E é também por isso que o País exige uma nova política e um novo caminho, onde rigor não seja confundido com austeridade dura e cega; onde a emigração em massa não seja uma solução, mas um problema; onde Portugal não tenha como ambição única ser um bom aluno no teste europeu de austeridade e saiba defender os interesses dos portugueses e de Portugal; um caminho que recuse a estagnação e o recuo social; um caminho que una os portugueses e não faça da confrontação o alibi para as dificuldades — o caminho que já tarda, mas que tem de estar nosso alcance!
126	P00001	P00329	125	A Mesa registou a inscrição de quatro Deputados para pedirem esclarecimentos à Sr.ª Deputada Sónia Fertuzinhos. Como pretende responder, Sr.ª Deputada?.
127	P00329	P00001	126	Responderei um a um, Sr.ª Presidente.
128	P00001	P00002		Muito bem, Sr.a Deputada. Vou dar a palavra ao primeiro orador inscrito, o Sr. Deputado Adão Silva, para formular o seu pedido de esclarecimentos. Tem a palavra, Sr. Deputado.
129	P00326	P00329	127	Sr.ª Presidente, Sr.a Deputada Sónia Fertuzinhos, governar é, essencialmente, governar para quem é mais carenciado. E governar é, sobretudo, governar para debelar, senão mesmo ultrapassar, por completo, as diferenças ou as desigualdades na distribuição do rendimento. Sr.a Deputada, governar é tomar medidas. V. Ex.ª, na sua intervenção de cerca de 8 minutos, escalpelizou um problema instante, que, não negamos, é um problema delicado. Mas, Sr.a Deputada, também seria interessante que nos apontasse algumas das soluções! Importa-se de nos apontar algumas das soluções?
130	P00327	P00326	129	Muito bem!
131	P00326	P00329	127	É que 8 minutos a escalpelizar um problema, a detalhar a estatística — difícil, aliás, de a seguir — , talvez fosse compensado se V. Ex.ª tivesse a generosidade, a bondade de nos apresentar algumas soluções, porque estamos a menos de meio ano de começarem a apresentar soluções governativas e V. Ex.ª não pode apenas ficar na análise detalhada, pormenorizada, dos números, tem de avançar também para as propostas de solução dos problemas.
132	P00327	P00326	131	É verdade!
133	P00326	P00329	127	Portanto, V. Ex.ª não as apresentou, o que é obviamente lamentável. Sr.a Deputada, V. Ex.ª referiu várias vezes «as opções políticas deste Governo»» Sr.a Deputada, as opções políticas deste Governo foram muito limitadas, porque o Programa de Assistência, que VV. Ex.as
134	P00327	P00326	133	Muito bem!
135	P00326	P00329	127	Sr.a Deputada, claro que VV. Ex.as estão presos a uma espécie de um labirinto ou a uma espécie de síndroma de prisão de labirinto. VV. Ex.as levaram o País à desgraça e o País está a reerguer-se. Os dados da economia estão a melhorar, os dados do emprego estão a melhorar,»
136	P00351	P00326	135	Está-se a ver!»
137	P00326	P00329	127	» os dados do desemprego estão a melhorar, os dados das exportações estão a melhorar! Mas, VV. Ex.as dizem que não, que é preciso negar isto, numa espécie de síndroma de quem ficou preso no vosso próprio labirinto, que foi o labirinto de atirarem Portugal para perto da bancarrota.
138	P00327	P00326	137	Muito bem!
139	P00326	P00329	127	Isso, obviamente, é muito complicado, Sr.a Deputada!
140	P00001	P00326	139	Queira concluir, Sr. Deputado Adão Silva.
141	P00326	P00329	127	Se me permite, Sr.ª Presidente, direi que V. Ex.ª, Sr.a Deputada Sónia Fertuzinhos, negou todas as evidências de que o País já deu a volta.
142	P00327	P00326	141	Muito bem!
143	P00326	P00329	127	Mas a pergunta que lhe faço, Sr. Deputada, é a seguinte: para lá da escalpelização e do detalhe dos números, diga-nos alguma coisa sobre como ultrapassar este problema, que é um problema magno da vida pública portuguesa, que existia no vosso tempo de Governo, que VV. Ex.as acrescentaram quando puseram Portugal na situação de resgate e que, obviamente, todos nós queremos ultrapassar o mais rapidamente possível.
144	P00001	P00002		Sr.ª Deputada Sónia Fertuzinhos, tem a palavra para responder.
145	P00329	P00326	143	Sr.ª Presidente, Sr. Deputado Adão Silva, respondo a cada uma das suas questões. O Sr. Deputado diz que o Governo tem de governar para quem é mais carenciado. Ora, Sr. Deputado, os números do INE sobre a pobreza são a prova mais clara do falhanço total e absoluto do seu Governo.
146	P00583	P00329	145	Bem lembrado!
