utterance_id	speaker_id	target_id	reply_to_id	utterance
147	P00329	P00326	143	Todas as medidas que tomaram falharam, porque se assim não fosse os números não eram aqueles que são. O Sr. Deputado pergunta quais são as soluções do Partido Socialista. Sr. Deputado, não queira saber quais são as nossas propostas para o próximo Programa do Governo, quando o senhor tinha de saber as propostas que fizemos para o Orçamento do Estado para 2015 e que os Srs. Deputados chumbaram! O Partido Socialista, exatamente porque os dados da pobreza em 2012 já eram suficientemente preocupantes, propôs aumentar o abono de família, propôs repor os passes escolares, propôs aumentar o subsídio social de desemprego, fez um desafio ao Governo de desistir do corte de 100 milhões de euros de duas prestações não contributivas substitutivas do rendimento do trabalho. O que é que os Srs. Deputados fizeram? Chumbaram as nossas propostas e sobre os 100 milhões de euros nada disseram. Pode ser que o Sr. Ministro da Solidariedade, que ainda não teve a decência de se pronunciar sobre os dados da pobreza, possa vir aqui falar sobre o que vai fazer aos 100 mil milhões de cortes que estão previstos. O Sr. Deputado diz que as opções deste Governo foram limitadas por causa do Memorando de Entendimento. Sr. Deputado, a sua memória está fraca, mas eu vou reavivá-la. Foi o Sr. Primeiro-Ministro, o Primeiro-Ministro da coligação PSD/CDS-PP, que disse o seguinte — e passo a citar: «Significa, portanto, que executar este Memorando de Entendimento não resulta de uma espécie de obrigação pesada que se cumpre apenas para ter a noção de dever cumprido».
148	P00583	P00329	147	Bem lembrado!
149	P00329	P00326	143	E dizia mais: «É curioso que o programa eleitoral que nós apresentámos no ano passado e aquilo que é o nosso Programa do Governo não têm uma dessintonia muito grande com aquilo que veio a ser o Memorando de Entendimento celebrado entre Portugal, a União Europeia e o FMI». Portanto, Sr. Deputado, não só o PSD disse «venha o FMI que não temos nenhum problema em governar com a troica», como disse «estamos completamente identificados com o Memorando.
150	P00326	P00329	149	Zero propostas!
151	P00329	P00326	150	Mas o Sr. Deputado nada disse sobre o ir muito além da troica.
152	P00327	P00329	151	Zero soluções!
153	P00329	P00326	150	É que os senhores cortaram mais de 8000 milhões do que o que estava previsto e um dos resultados foi o de mais 500 000 portugueses pobres, Sr. Deputado. Sobre isto o Sr. Deputado nada disse.
154	P00001	P00002		Tem a palavra a Sr.ª Deputada Mariana Aiveca para pedir esclarecimentos.
155	P00274	P00329	153	Sr.ª Presidente, Sr.as e Srs. Deputados, Sr.ª Deputada Sónia Fertuzinhos, creio que trouxe aqui um problema de grande importância e que fez um retrato do País. Já lhe disseram a si, como disseram a este Parlamento, pela voz do Sr. Deputado Adão Silva, que o programa eleitoral do PSD não era o «programa das festas». De facto, não era, tinha o título «Está na hora de mudar» e o primeiro candidato desse programa prometia, se fosse Primeiro-Ministro, que não cortaria o subsídio de Natal, não cortaria os subsídios de férias, muito menos cortaria salários ou pensões. De facto, não foi um programa de festa, mas foi um programa bem negro, porque durante estes quatro anos os senhores cortaram em toda a linha no rendimento das famílias e, particularmente, nos rendimentos dos mais pobres. E têm hoje um País onde quase dois milhões de pessoas vivem com menos de 411 €. E destes dois milhões, mais de metade, ou seja, 975 000 pessoas, têm um rendimento inferior a 286 €.
156	P00579	P00274	155	Seja séria, Sr.ª Deputada!
157	P00274	P00329	153	Não era o programa das festas! Foi o programa que cortou todos os apoios sociais, dizendo até que os desempregados eram culpados da sua própria situação, dizendo até que havia uma certa preguiça por parte desses mesmos desempregados e, por isso, tinham que fazer trabalho à borla — que é o que fazem hoje os desempregados com contratos emprego-inserção e contratos emprego-inserção +. Têm hoje um País onde são as crianças quem mais sofre com a pobreza. Falam em medidas, mas creio que as medidas que foram aparecendo ao longo destes quatro anos foram todas elas chumbadas, porque, de facto, houve dinheiro para salvar a banca, continuaram com o regabofe das PPP, mas o dinheiro para prestações sociais foi trancado. Este foi, pois, um «programa das festas» muito mal contado.
158	P00001	P00274	157	Queira concluir, Sr.ª Deputada.
159	P00274	P00329	153	A pobreza é hoje a marca deste País. Perguntava-lhe, pois, Sr.ª Deputada Sónia Fertuzinhos, se não acha que o principal rosto destas políticas devia ter a decência de vir hoje ao Parlamento dar a cara por esse programa tão escuro, tão negro, do qual foi o principal executor.
160	P00001	P00002		Tem a palavra a Sr.ª Deputada Sónia Fertuzinhos para responder.
161	P00329	P00274	159	Sr.ª Presidente, Sr.ª Deputada Mariana Aiveca, de facto, tem toda a razão. A estratégia deste Governo falhou, porque fez várias coisas ao mesmo tempo que não podia ter feito: como disse, cortou os apoios sociais, o RSI e o CSI, fez diminuir os beneficiários do abono de família, cortou também nos rendimentos dos salários e das pensões, e tudo isto ao mesmo tempo que o desemprego aumentava. É óbvio que todas estas componentes juntas tinham que dar um resultado desastroso como é aquele que os dados da pobreza de 2013 refletem e que já refletiam em 2012, o que deviam ter levado o Governo a fazer orçamentos diferentes para 2014 e para 2015, mas como sabemos, para esses anos o Governo manteve a decisão e a opção política de continuar a cortar nos apoios sociais e, sobretudo, nos apoios sociais mais dirigidos ao combate à pobreza e ao apoio às famílias. Mas, Sr.ª Deputada Mariana Aiveca, se juntarmos a estes dados e a este cenário os dados da emigração, em que cerca de 400 000 portugueses e portuguesas emigraram, muitos deles os mais jovens e mais qualificados, e se juntarmos ainda um tema que o Governo e a maioria dizem ser muito caro, que é o da natalidade — sabemos que relativamente ao número de nascimentos entre 2011 e 2013 houve uma diminuição de 18% mas entre 1990 e 2010 o número de nascimentos tinha diminuído 13% (repare bem, Sr.ª Deputada, o drama que está nestes números) — , de facto, o País tem um problema grave para resolver, e esse problema só se resolve invertendo a política de austeridade tal como ela foi aplicada pelo Governo.
162	P00001	P00002		Tem a palavra o Sr. Deputado Jorge Machado para um pedido de esclarecimento.
163	P00267	P00329	161	Sr.ª Presidente, Srs. Deputados, Sr.ª Deputada Sónia Fertuzinhos, consideramos que o Governo PSD/CDS-PP é responsável por um gigantesco aumento da pobreza no nosso País — são 2,7 milhões de pobres e, se ancorarmos os dados da pobreza nos rendimentos de 2009, representam 25,9% da população. Entendemos mesmo que, hoje, o Ministro Mota Soares deveria estar neste Parlamento a discutir o que são os dados da pobreza. Feliz ou infelizmente — na nossa perspetiva, infelizmente — , o PSD agendou um debate de atualidade sobre licenciamento ambiental. Para nós, o debate de atualidade seria sobre os dados da pobreza e o agravamento da pobreza no nosso País. Esse é que era o debate de atualidade que se impunha! Mas fica marcado, então, para dia 12, o debate com o Sr. Ministro, como propôs o PCP. Sr.ª Deputada, temos uma dúvida relativamente aos dados que analisa. Efetivamente, o Governo do PSD/CDS-PP é responsável por um agravamento de mais 30% da pobreza; PSD e CDS-PP atiram para a pobreza 629 000 pessoas no período em que são Governo, mas se juntarmos os dados de 2010, do Governo do PS, então são mais 45%, são 808 000 pessoas que foram atiradas para a pobreza. A linha de pobreza ancorada no tempo era de 17,9% em 2009, em 2010 disparou para 19,6%, em 2011 chegou aos 21,3%, em 2012 atingiu os 24% e em 2013 alcançou os 25%. Há um aumento sistemático dos dados da pobreza. A pergunta que queríamos colocar é no sentido de saber se a Sr.ª Deputada entende, ou não, que os PEC e a troica que o PS foi mantendo com o PSD e com o CDS-PP são, ou não, responsáveis pelo agravamento da pobreza no nosso País.
164	P00262	P00267	163	Outra vez os PEC não!
165	P00267	P00329	161	O nosso entendimento é o de que esses PEC e o Memorando de Entendimento, o pacto que o PS assinou com o PSD e o CDS-PP e com a troica foram os responsáveis das linhas de fundo que atiraram milhares de portugueses para a pobreza. A Sr.ª Deputada diz, e é verdade, que a pobreza resulta de opções políticas. Vejamos: condição de recursos — Decreto-lei n.º 70/2010, que o PS criou e que agora está a ser usado pelo PSD e pelo CDS-PP para cortar em prestações sociais como nunca vimos no nosso País; os cortes no abono de família iniciados pelo PS; os cortes no subsídio de desemprego iniciados pelo PS e agora aproveitados pelo PSD e pelo CDSPP para continuar a cortar a quem está desempregado; a desproteção laboral e o ataque aos direitos de quem trabalha através de revisões ao Código do Trabalho promovidas por PS, PSD e CDS-PP; o corte nos salários e nas reformas. Sr.ª Deputada, o PS não diverge assim tanto do PSD. A Sr.ª Deputada diz que o PSD não diverge da troica, porque Passos Coelho assumiu uma posição em que o programa do PSD era semelhante ao programa da troica. Ora, o programa da troica era semelhante ao programa do PS, portanto PS, PSD e CDS-PP convergem na política de direita do nosso País. Esse é, ou não, um fator que contribui para o agravamento da pobreza do nosso País?
166	P00001	P00002		Para responder, tem a palavra a Sr.ª Deputada Sónia Fertuzinhos.
167	P00329	P00267	165	Sr.ª Presidente, Sr. Deputado Jorge Machado, de facto, seria normal que o Sr. Ministro Mota Soares, se existisse enquanto Ministro da Solidariedade — já houve vários momentos em que provou que não existia, este é apenas mais um — , já se tivesse pronunciado, porque estes dados foram divulgados na sexta-feira e até hoje ainda não se fez ouvir. Mas, Sr. Deputado, mais do que o Sr. Ministro Mota Soares, teria de ser o Sr. Primeiro-Ministro a vir a esta Assembleia, até por iniciativa própria, responder por esses dados da pobreza e dizer, enquanto primeiro responsável pelo Governo, o que é que entende que deve alterar nas suas políticas para que estes dados não continuem a agravar-se. O Sr. Deputado, no seu pedido de esclarecimento, tentou ligar as políticas do PS ao PSD e ao CDS-PP e às políticas da direita, e falou de um pacto. Sr. Deputado, o maior pacto a que já se assistiu nesta Assembleia foi o pacto entre o Partido Comunista, o PSD e o CDS-PP»
168	P00010	P00329	167	Oh!»
169	P00329	P00267	165	»para chumbarem o PEC 4, que abriu caminho á troica. Portanto, Sr. Deputado, que o PCP também saiba assumir as suas responsabilidades.
170	P00351	P00329	169	Traíram os pobres!
171	P00329	P00267	165	Mas se o Sr. Deputado e o PCP consideram que o PS — que criou o rendimento social de inserção, que criou o complemento solidário para idosos, que apostou no ensino préescolar, que apostou na escola a tempo inteiro, que apostou nos passes escolares — , com as suas políticas, com tudo isto que referi, é parecido com o PSD e o CDS, então, não sei o que é que o PCP consideraria ser diferente. Julgo que, mais do que isto, a sua intervenção não merece nenhum comentário da minha parte.
172	P00001	P00002		Para pedir esclarecimentos, tem a palavra o Sr. Deputado Artur Rêgo.
173	P00579	P00329	171	Sr.ª Presidente, Sr.ª Deputada Sónia Fertuzinhos, a pobreza é uma preocupação constante para nós, assim como deve ser para todos os portugueses. Também o é para o Governo, tal como o desemprego. Ora, ao combater-se o desemprego está a combater-se também a pobreza, Sr.ª Deputada. Sr.ª Deputada, para recentrar o debate, de forma séria, no cerne da questão, quero dizer-lhe que os dados do INE referidos dizem respeito a 2013. Ora, como todos sabemos, no primeiro trimestre de 2013 foi atingido o pico do desemprego neste País. Este desemprego foi uma consequência da crise, foi uma consequência da falência do País, foi uma consequência do primeiro tratamento de choque que resultou da aplicação das medidas do Memorando.
174	P00351	P00579	173	Isso foi em 2012!
175	P00579	P00329	171	Felizmente, de 2013 até hoje já mediou o ano de 2014 e já tivemos oito trimestres consecutivos de crescimento da economia, de crescimento do emprego e de descida da taxa de desemprego. Os protestos são sinal de que estão a sentir-se incomodados com a minha intervenção! Portanto, tivemos o crescimento da economia, o crescimento do emprego e a diminuição da taxa de desemprego.
176	P00583	P00579	175	E mais pobreza!
177	P00579	P00329	171	Sr.ª Deputada, seriamente, face a isto tudo, e quando se criaram mais de 130 000 postos de trabalho líquidos desde essa altura até agora, segundo as estatísticas do INE, não é compaginável dizer-se que relativamente a 2014 — é a nossa expetativa e a nossa confiança — se manterão os dados constantes da estatística do INE relativos a 2013. Sr.ª Deputada, não obstante, tendo essa preocupação em mente e noção dessa realidade, este Governo, desde o primeiro ano — de resto, basta ler os Orçamentos do Estado — , aumentou sempre o valor das transferências para prestações sociais. Aumentou sempre!
178	P00274	P00579	177	Essa agora!
179	P00579	P00329	171	Portanto, é falso que tenha cortado esses valores, porque aumento-os sempre. Sr.ª Deputada, os dados do INE relatam a situação em que, por força do que se passou, ficaram muitos portugueses em 2013 e a diminuição dos rendimentos médios, mas não refere, como é evidente, algo que resultou da preocupação do Governo: a criação de uma rede local com transferências económicas de milhares de milhões de euros do Governo para as instituições de solidariedade social, precisamente para acudir a essas pessoas que estavam em estado de necessidade. Isso não vem lá relatado, Sr.ª Deputada! Portanto, ninguém ficou para trás, as pessoas de menores recursos tiveram apoio no terreno através dos programas que o Governo criou em colaboração com as instituições particulares de solidariedade social (IPSS). Dito isto, gostaria de me reportar ao que foi dito Sr. Deputado Adão Silva, quando referiu que este Memorando não é um programa de festas. Pois não é, Sr.ª Deputada, concordo plenamente, mas é um programa que resulta das festas do Partido Socialista.
180	P00509	P00579	179	Muito bem!
181	P00579	P00329	171	Resulta da festa que para o Partido Socialista foi a sua governação, Sr.ª Deputada. E essa festa teve o seu culminar de esbanjamento em 2009, em período pré-eleitoral, sem bem se lembra, quando, com o País já falido, aumentou os vencimentos em 3,5% e diminuiu o IVA.
182	P00001	P00579	181	Sr. Deputado, queria concluir.
183	P00579	P00329	171	Concluo já, Sr.ª Presidente. E o que é que resultou em 2010? Deixo-lhe esta pergunta para concluir.
184	P00001	P00579	183	É mesmo para concluir, Sr. Deputado, por favor.
185	P00579	P00329	171	Vou mesmo concluir, Sr.ª Presidente.
186	P00001	P00579	185	Sr. Deputado, tem mesmo de concluir.
187	P00579	P00329	171	Concluo já, Sr.ª Presidente. Sr.ª Deputada, estas são as verdadeiras questões. Quem é que cortou? Foi o PS ou fomos nós? Quem é que esbanjou? Foi o PS ou fomos nós?
188	P00267	P00579	187	Foram os dois!
189	P00001	P00002		Para responder, tem a palavra a Sr.ª Deputada Sónia Fertuzinhos.
190	P00329	P00579	187	Sr.ª Presidente, Sr. Deputado Artur Rêgo, para quem tem responsabilidades governativas como tem o CDS-PP neste momento, não basta dizer, perante os números, que a pobreza é uma preocupação constante. Com certeza que a pobreza é uma preocupação constante, mas os partidos que apoiam o Governo não podem limitar-se a fazer afirmações destas. O primeiro erro que o Governo pode fazer, e que, de resto, o Sr. Primeiro-Ministro já fez, é, perante estes dados da pobreza, desvalorizá-los, dizer que já não são muitos importantes porque já não refletem a realidade que vivemos hoje — que não se pode avaliar, não é verdade? — , mas, sim, uma realidade do passado. Portanto, Sr. Deputado, nesse erro o Partido Socialista não cai. Por outro lado, em 2014 e em 2015 mantêm-se os cortes nos apoios sociais.
191	P00579	P00329	190	Diga quais!
192	P00329	P00579	191	E nem o PSD nem o CDS disseram ainda, neste debate, se continuam ou não com a intenção de manter o corte de 100 milhões de euros nas prestações sociais que está previsto no Orçamento do Estado para 2015.
193	P00006	P00329	192	Bem lembrado!
194	P00329	P00579	191	Ora, uma vez que o Governo não está presente, era a esta questão que os Srs. Deputados da maioria deviam ter a capacidade de responder.
195	P00579	P00329	194	Diga que subsídios é que cortámos!
196	P00329	P00579	195	O Sr. Deputado falou na descida do desemprego. Sr. Deputado, estes números relativos à pobreza refletem também uma realidade assustadora: a pobreza nas pessoas empregadas continua a aumentar, ou seja, as pessoas que trabalham, que têm rendimentos do trabalho, continuam a não ganhar o suficiente para sair da situação de pobreza. É a isto que o Sr. Deputado e o seu partido também têm de responder. O Sr. Deputado falou, ainda, do peso das transferências sociais em 2013. É verdade que o peso das transferências sociais em 2013 foi ligeiramente melhor do que em 2012, mas mesmo assim esteve abaixo de 2011. Se o Sr. Deputado se contenta com este número é porque não está a querer ver a realidade no seu todo. Quanto à festa do PS, não vou classificar o mau gosto desta expressão que a maioria tanto gosta de usar. Vou apenas recordar-lhe que o atual Primeiro-Ministro, relativamente à atuação do Governo do Partido Socialista em 2009 e 2010, disse que, no essencial — aliás, há registos na comunicação social que o mostram — , o Governo estava a saber responder bem à crise.
197	P00351	P00329	196	Bem lembrado!
198	P00329	P00579	195	Disse que o Governo estava a atuar de acordo com as orientações da União Europeia — porque os Srs. Deputados têm de saber que as medidas do Governo do Partido Socialista em 2009 e 2010 se enquadraram na estratégia europeia de combate à crise — , que as medidas estavam corretas. Portanto, digam os Srs. Deputados o que disserem, acusem o Partido Socialista do que acusarem, a realidade é uma e indesmentível: a vossa atuação no Governo aumentou a pobreza; a vossa estratégia de austeridade expansionista aumentou a pobreza. E, mesmo aumentando a pobreza, nem sequer conseguiram consolidar as contas públicas.
199	P00262	P00001	189	Sr.ª Presidente, peço a palavra para interpelar a Mesa sobre a condução dos trabalhos.
200	P00001	P00262	199	Tem a palavra, Sr. Deputado.
201	P00262	P00001	200	Sr.ª Presidente, eu tentei não fazer esta interpelação, mas pela terceira vez a Sr.ª Deputada Sónia Fertuzinhos referiu-se ao facto de o Sr. Ministro ou o Governo não estarem presentes. Assim sendo, queria fazer-lhe duas perguntas, Sr.ª Presidente, até para informação de quem nos está a ouvir e a ver. Em primeiro lugar, no espaço dedicado a declarações políticas é hábito o Governo estar presente? Em segundo lugar, Sr.ª Presidente, gostaria de saber se o Partido Socialista requereu qualquer tipo de debate, em tempo, para que o Sr. Ministro estivesse aqui presente. É que não vale a pena estar aqui a dizer, da maneira como a Sr.ª Deputada o fez, por três vezes, que o Sr. Ministro não está presente (à primeira vez fingi que não ouvi, à segunda também) como se o Sr. Ministro não estivesse cá porque fugiu, quando não fugiu. Aliás, não só não fugiu como nem sequer o PS requereu a sua presença.
202	P00001	P00262	201	Sr. Deputado, devo assumir que a sua primeira pergunta é retórica, porque qualquer pessoa com o mínimo de experiência neste Parlamento sabe que o período de declarações políticas não tem a participação de membros do Governo. A sua segunda pergunta terá de ser dirigida à bancada do Partido Socialista. Assim, desde já pergunto à Sr.ª Deputada Sónia Fertuzinhos se, de alguma forma, convidou ou solicitou a presença do Sr. Ministro, visto que se queixou da sua ausência.
203	P00329	P00001	202	Sr.ª Presidente, naturalmente, a questão que coloquei não é de natureza regimental, é de natureza política. E aquilo que eu disse, ou seja, que o Sr. Ministro Mota Soares ainda não se pronunciou sobre os dados da pobreza, é absolutamente verdade. Basta tentar procurar na imprensa qualquer declaração do Sr. Ministro que não a encontrarão, como eu também não encontrei.
204	P00001	P00329	203	Compreendo a sua intenção, Sr.ª Deputada, mas a Mesa também ouviu o seu registo sobre a não presença do Sr. Ministro no Plenário.
205	P00584	P00001	204	Sr.ª Presidente, isenção!
206	P00001	P00584	205	Mas é muito fácil confirmar, basta recorrer às gravações do Canal Parlamento. Prosseguindo com as declarações políticas, tem a palavra o Sr. Deputado Abel Baptista.
207	P00585	P00002		Sr.ª Presidente, Sr.as e Srs. Deputados: Foi hoje publicada a Portaria n.º 19/2015, de 4 de fevereiro, que aprova o modelo de compensação forfetária para os pequenos produtores agrícolas que reúnam as condições de aplicação do regime especial de isenção de IVA, permitindo àqueles sujeitos passivos solicitarem à Autoridade Tributária e Aduaneira uma compensação em sede de IVA relacionada com a sua atividade agrícola. De uma forma simples, passaremos a chamar-lhe regime de compensação do IVA para pequenos agricultores. Esta compensação destina-se a atenuar o impacto do imposto suportado nas aquisições de bens e serviços para o exercício da atividade económica do pequeno produtor agrícola. Este regime de compensação de IVA para pequenos agricultores abrange 129 172 sujeitos passivos que podem ser beneficiários. Estes beneficiários dedicam-se às seguintes culturas: policultura (48 101 pequenos agricultores) — os beneficiários produzem diversas culturas, sem que qualquer uma delas abarque dois terços do total da produção padrão, como, por exemplo, a produção de arroz, de floricultura ou de horticultura; produções mistas (13 849 pequenos agricultores) — idêntica à policultura, com a diferença de que tem também atividade de produção animal; outros ruminantes (11 577 pequenos agricultores) — ovinos e caprinos; olival (11 343 pequenos agricultores); arvenses e outras culturas predominantes de regadio (cerca de 15 000 pequenos agricultores) — milho, trigo, centeio, aveia, em modo de regadio ou sequeiro; finalmente, vinhos (8 161 pequenos agricultores). O regime de compensação de IVA para pequenos agricultores tem um impacto de cerca de 21,4 milhões de euros que a pequena economia agrícola vai receber. Este é um marco histórico na vida dos pequenos agricultores. O regime do IVA foi introduzido em Portugal em 1 de janeiro de 1986. Repito: o regime do IVA foi introduzido em Portugal em 1 de janeiro de 1986. Só passados 29 anos é que os pequenos agricultores podem receber uma compensação do imposto que pagam para produzir as suas culturas, e por isso também esta portaria é um marco histórico, dando a possibilidade de estes pequenos agentes económicos serem compensados em 10% do seu volume de negócios, desde que o seu rendimento seja inferior a 10 000 € anuais. O carácter histórico desta medida é ainda relevado pelo facto de ser uma possibilidade comunitária há muito permitida e em prática em mais 17 países, mas que só agora é implementada em Portugal. Sr.ª Presidente, Sr.as e Srs. Deputados, o modelo de pedido de compensação do IVA para pequenos agricultores agora aprovado e publicado é simples, podendo ser feito por via eletrónica, através do portal das finanças, ou por apresentação verbal em qualquer serviço de finanças, devendo o pedido apenas conter dois elementos: o valor das transmissões de bens e da prestação de serviços efetuadas no semestre precedente que conferem o direito à compensação; os números de identificação fiscal dos adquirentes ou destinatários das referidas operações. Os pedidos são feitos até 20 de julho ou 20 de janeiro de cada ano relativamente às operações efetuadas no semestre anterior e a Autoridade Tributária e Aduaneira (AT) analisa e credita, em caso de deferimento, no prazo de 45 dias, o montante da compensação na conta bancária do sujeito passivo. As cooperativas, as adegas e as organizações de produtores podem e devem desempenhar aqui um papel importante de apoio e de acompanhamento dos pequenos produtores. Já há várias organizações a fazer a formação e a difusão deste regime, como é o caso da Ordem dos Técnicos Oficiais de Contas e da CAP, com o apoio do PRODER, do Ministério da Agricultura e Mar e do Fundo Europeu Agrícola de Desenvolvimento Rural. A primeira dessas ações vai decorrer já na próxima segunda-feira em Santarém e outras se seguem, entre 23 de fevereiro e 13 de março, de Norte a Sul e do Interior ao Litoral do País, de Ponte de Lima a Macedo de Cavaleiros, de Vila Nova de Foz Coa a Aveiro, de Leiria a Grândola. Serão mais de 12 ações de formação gratuitas destinadas a agricultores e técnicos oficiais de contas.
208	P00001	P00002		Há inscrições por parte do PS, do PSD e do PCP para pedidos de esclarecimento ao Sr. Deputado Abel Baptista. Em primeiro lugar, tem a palavra o Sr. Deputado Miguel Freitas, do PS.
